"DESCRIPTION","DURATION IN MS","NAME","PARENT SUITE","START TIME","STATUS","STOP TIME","SUB SUITE","SUITE","TEST CLASS","TEST METHOD"
"","2132","CT-002 | Deve exibir mensagem adequada quando nenhum resultado é encontrado","","2026-03-24","passed","2026-03-24","","Pesquisa de Artigos - Blog do Agi","",""
"","4042","CT-001 | Deve retornar resultados ao pesquisar por termo válido","","2026-03-24","passed","2026-03-24","","Pesquisa de Artigos - Blog do Agi","",""
"","682","CT-S02 | [SMOKE] Pesquisa sem resultado exibe mensagem de feedback ao usuário","","2026-03-24","passed","2026-03-24","","Smoke Tests - Pesquisa Blog do Agi","",""
"","2621","CT-004 | O termo pesquisado deve ser refletido na URL como parâmetro ?s=","","2026-03-24","passed","2026-03-24","","Pesquisa de Artigos - Blog do Agi","",""
"","4360","CT-005 | Deve permitir múltiplas pesquisas sequenciais sem necessidade de reload","","2026-03-24","passed","2026-03-24","","Pesquisa de Artigos - Blog do Agi","",""
"","15895","CT-006 | O primeiro resultado deve ser clicável e abrir o artigo correspondente","","2026-03-24","failed","2026-03-24","","Pesquisa de Artigos - Blog do Agi","",""
"","491","CT-003 | A barra de pesquisa deve ser acessível via ícone de lupa","","2026-03-24","passed","2026-03-24","","Pesquisa de Artigos - Blog do Agi","",""
"","2524","CT-S01 | [SMOKE] Pesquisa com termo válido exibe artigos relevantes","","2026-03-24","passed","2026-03-24","","Smoke Tests - Pesquisa Blog do Agi","",""
