"Status","Start Time","Stop Time","Duration in ms","Parent Suite","Suite","Sub Suite","Test Class","Test Method","Name","Description"
"skipped","Wed May 06 10:18:04 UTC 2026","Wed May 06 10:18:04 UTC 2026","0","","Pesquisa de Artigos - Blog do Agi","","","","CT-004 | O termo pesquisado deve ser refletido na URL como parâmetro ?s=",""
"broken","Wed May 06 10:17:48 UTC 2026","Wed May 06 10:18:04 UTC 2026","15949","","Pesquisa de Artigos - Blog do Agi","","","","CT-001 | Deve retornar resultados ao pesquisar por termo válido",""
"skipped","Wed May 06 10:18:04 UTC 2026","Wed May 06 10:18:04 UTC 2026","0","","Pesquisa de Artigos - Blog do Agi","","","","CT-002 | Deve exibir mensagem adequada quando nenhum resultado é encontrado",""
"skipped","Wed May 06 10:18:04 UTC 2026","Wed May 06 10:18:04 UTC 2026","1","","Pesquisa de Artigos - Blog do Agi","","","","CT-005 | Deve permitir múltiplas pesquisas sequenciais sem necessidade de reload",""
"broken","Wed May 06 10:18:41 UTC 2026","Wed May 06 10:18:57 UTC 2026","15859","","Smoke Tests - Pesquisa Blog do Agi","","","","CT-S01 | [SMOKE] Pesquisa com termo válido exibe artigos relevantes",""
"skipped","Wed May 06 10:18:04 UTC 2026","Wed May 06 10:18:04 UTC 2026","0","","Pesquisa de Artigos - Blog do Agi","","","","CT-006 | O primeiro resultado deve ser clicável e abrir o artigo correspondente",""
"skipped","Wed May 06 10:18:04 UTC 2026","Wed May 06 10:18:04 UTC 2026","0","","Pesquisa de Artigos - Blog do Agi","","","","CT-003 | A barra de pesquisa deve ser acessível via ícone de lupa",""
"skipped","Wed May 06 10:18:57 UTC 2026","Wed May 06 10:18:57 UTC 2026","0","","Smoke Tests - Pesquisa Blog do Agi","","","","CT-S02 | [SMOKE] Pesquisa sem resultado exibe mensagem de feedback ao usuário",""
