"Status","Start Time","Stop Time","Duration in ms","Parent Suite","Suite","Sub Suite","Test Class","Test Method","Name","Description"
"skipped","Thu Apr 30 10:09:04 UTC 2026","Thu Apr 30 10:09:04 UTC 2026","0","","Pesquisa de Artigos - Blog do Agi","","","","CT-003 | A barra de pesquisa deve ser acessível via ícone de lupa",""
"skipped","Thu Apr 30 10:10:17 UTC 2026","Thu Apr 30 10:10:17 UTC 2026","0","","Smoke Tests - Pesquisa Blog do Agi","","","","CT-S02 | [SMOKE] Pesquisa sem resultado exibe mensagem de feedback ao usuário",""
"skipped","Thu Apr 30 10:09:04 UTC 2026","Thu Apr 30 10:09:04 UTC 2026","0","","Pesquisa de Artigos - Blog do Agi","","","","CT-002 | Deve exibir mensagem adequada quando nenhum resultado é encontrado",""
"broken","Thu Apr 30 10:09:59 UTC 2026","Thu Apr 30 10:10:17 UTC 2026","18156","","Smoke Tests - Pesquisa Blog do Agi","","","","CT-S01 | [SMOKE] Pesquisa com termo válido exibe artigos relevantes",""
"skipped","Thu Apr 30 10:09:04 UTC 2026","Thu Apr 30 10:09:04 UTC 2026","0","","Pesquisa de Artigos - Blog do Agi","","","","CT-004 | O termo pesquisado deve ser refletido na URL como parâmetro ?s=",""
"skipped","Thu Apr 30 10:09:04 UTC 2026","Thu Apr 30 10:09:04 UTC 2026","0","","Pesquisa de Artigos - Blog do Agi","","","","CT-005 | Deve permitir múltiplas pesquisas sequenciais sem necessidade de reload",""
"broken","Thu Apr 30 10:08:43 UTC 2026","Thu Apr 30 10:09:04 UTC 2026","20907","","Pesquisa de Artigos - Blog do Agi","","","","CT-001 | Deve retornar resultados ao pesquisar por termo válido",""
"skipped","Thu Apr 30 10:09:04 UTC 2026","Thu Apr 30 10:09:04 UTC 2026","0","","Pesquisa de Artigos - Blog do Agi","","","","CT-006 | O primeiro resultado deve ser clicável e abrir o artigo correspondente",""
